<?xml version="1.0" encoding="utf-8"?>
<!DOCTYPE GRAPH SYSTEM "genplots.dtd">
<GRAPH outputfile="test.eps">
<SOURCEFILE name="genplot_example.csv" fileid="xyz" headerlines="1" wsseparated="false"/>
<PLOT color="red" width="4.0" style="ldash">
<PLOTDATA>
<TUPLE x="1" y="1"/>
<TUPLE x="2" y="4"/>
<TUPLE x="3" y="9"/>
<TUPLE x="4" y="16"/>
<TUPLE x="5" y="25"/>
<TUPLE x="6" y="36"/>
</PLOTDATA>
</PLOT>
<PLOT>
<PLOTFILE fileid="xyz" xcol="0" ycol="1"/>
</PLOT>
<PLOT>
<PLOTFILE fileid="xyz" xcol="0" ycol="1" style="sdash"/>
</PLOT>
<TEXT x="3" y="50" color="blue" width="2.0">example</TEXT>
</GRAPH>

