<?xml version="1.0" encoding="utf-8"?>
<!DOCTYPE GRAPH SYSTEM "genplots.dtd">
<GRAPH outputfile="genplot_example2.eps">
<SOURCEFILE name="genplot_example.csv" fileid="xyz" headerlines="1" wsseparated="false"/>
<AXIS direction="x" axisid="xaxis1" log="true" displaymajorindices="true" displayminorindices="true" title="X-axis" min="0.9" max="10"/>
<AXIS direction="y" axisid="yaxis1" displaymajorindices="false" title="Y-axis" min="0" max="1000"/>
<AXIS direction="y" axisid="yaxis2" log="true" displaymajorindices="true" title="Y2-axis" min="0.1" max="1000"/>
<PLOT yaxisid="yaxis1" xaxisid="xaxis1" color="red" width="4.0" style="ldash">
<PLOTDATA>
<TUPLE x="1" y="1"/>
<TUPLE x="2" y="4"/>
<TUPLE x="3" y="9"/>
<TUPLE x="4" y="16"/>
<TUPLE x="5" y="25"/>
<TUPLE x="6" y="36"/>
</PLOTDATA>
</PLOT>
<PLOT yaxisid="yaxis1" xaxisid="xaxis1" >
<PLOTFILE fileid="xyz" xcol="0" ycol="1"/>
</PLOT>
<PLOT yaxisid="yaxis2" xaxisid="xaxis1" >
<PLOTFILE fileid="xyz" xcol="0" ycol="1"/>
</PLOT>
<TEXT xaxisid="xaxis1" yaxisid="yaxis1" x="3" y="50" color="blue" width="2.0">example</TEXT>
</GRAPH>

